tema_detectado,motivo_real,insight_estrategico,exemplos_representativos,cluster
Processo de vendas,"As empresas estão interessadas em fechar negócios, com destaque para a KappaSoft que aparece mais vezes nas interações.","Focar esforços de vendas na KappaSoft, pois parece haver um interesse significativo deles em nossos produtos/serviços. Além disso, é importante manter um bom relacionamento com as outras empresas e buscar novas oportunidades de negócios.","['Proposta para KappaSoft | Descrição: nan | Status: closedwon | Canal: nan', 'Contrato enviado para KappaSoft | Descrição: nan | Status: contractsent | Canal: nan']",0
Processo de Vendas,"As empresas estão no processo de negociação e fechamento de contratos, indicando interesse em comprar ou considerar a compra devido à necessidade de serviços ou produtos oferecidos.","A equipe de vendas deve focar em acompanhar de perto esses contratos enviados e agendar apresentações para garantir que as negociações sejam concluídas com sucesso. Além disso, o marketing pode criar materiais de apoio para ajudar a destacar os benefícios e diferenciais dos produtos/serviços oferecidos.","['Empresa: Contrato enviado para OmegaIndustries | Descrição: nan | Status: contractsent | Canal: nan', 'Empresa: Negociação com OmegaIndustries | Descrição: nan | Status: closedwon | Canal: nan']",1
Processo de vendas para EpsilonData,"A EpsilonData mostrou interesse em comprar, passou por várias etapas do processo de vendas, incluindo qualificação, apresentação, decisão do tomador de decisão e envio de contrato.","A EpsilonData parece ser um cliente potencialmente valioso, com várias interações de vendas bem-sucedidas. No entanto, também houve uma venda perdida, o que sugere que pode haver espaço para melhorar a abordagem de vendas ou o produto oferecido. Recomenda-se uma revisão detalhada do processo de vendas para identificar possíveis áreas de melhoria.","['Empresa: Proposta para EpsilonData | Descrição: nan | Status: qualifiedtobuy | Canal: nan', 'Empresa: Contrato enviado para EpsilonData | Descrição: nan | Status: decisionmakerboughtin | Canal: nan']",2
Processo de vendas,"A falta de informações detalhadas na descrição dificulta a identificação de um motivo específico para a compra. No entanto, o fato de que as empresas entraram em contato e avançaram no processo de vendas sugere um interesse inicial nos produtos ou serviços oferecidos.","É crucial coletar e registrar mais informações durante o processo de vendas para entender melhor as motivações dos clientes. Isso pode ser feito através de questionários, entrevistas ou simplesmente incentivando a equipe de vendas a registrar observações detalhadas. Além disso, a empresa deve continuar a se envolver proativamente com potenciais clientes, já que isso parece estar gerando algum sucesso.","['Empresa: Contato iniciado com ZetaCloud | Descrição: nan | Status: closedwon | Canal: nan', 'Empresa: Contato iniciado com LambdaSystems | Descrição: nan | Status: decisionmakerboughtin | Canal: nan']",3
Processo de vendas para a empresa BetaLog,"A empresa BetaLog está considerando a compra devido ao início do contato e às propostas enviadas, mas também houve perdas no processo de venda.","Revisar as propostas e contratos enviados para a BetaLog para entender as razões das perdas e melhorar a abordagem de vendas. Além disso, manter um acompanhamento constante após o envio de propostas e contratos pode ajudar a garantir que a venda seja concluída.","['Empresa: Proposta para BetaLog | Descrição: nan | Status: closedwon | Canal: nan', 'Empresa: Contrato enviado para BetaLog | Descrição: nan | Status: closedlost | Canal: nan']",4
